"Question","Answer"
"What is Fortress?","Fortress is a comprehensive inventory management system designed to streamline stock, orders, and warehouse operations with powerful analytics and automation."
"How do I sign up for a new account?","On the login page, click 'Sign Up'. Enter your email and a strong password. You'll receive a confirmation email to verify your account. After confirmation, you can log in and complete the initial setup."
"What is a 'Company Code' during sign-up?","If your organization already uses Fortress, your administrator can provide you with a unique 'Company Code'. Entering this code during sign-up will automatically link your new account to your company's existing inventory and user base."
"How do I set up my company profile?","After signing in, you'll be guided through an onboarding wizard. You can also go to 'Settings' to update your company name, currency, address, and company logo."
"How do I manage inventory folders?","Navigate to the 'Folders' page. You can add new folders (e.g., Main Warehouse, Shelf A) and generate QR code labels for them. You can also edit or delete existing folders."
"How do I add a new inventory item?","Go to the 'Inventory' page, then click '+ Add New Item'. Fill in details like item name, SKU, quantities (picking bin, overstock), reorder levels, costs, and assign it to a folder. You can also upload an image and enable auto-reorder."
"How can I import my existing inventory from a CSV file?","On the 'Inventory' page, click the 'Tools' dropdown and select 'Import CSV'. You can download a template to ensure your data is formatted correctly for bulk upload."
"How can I perform a bulk update on my inventory?","On the 'Inventory' page, click the 'Tools' dropdown and select 'Bulk Update'. You can download a template, fill in the SKUs and fields you wish to update, and then upload the CSV."
"How do I delete an inventory item?","On the 'Inventory' page, in either table or card view, find the item you wish to delete. For table view, click the 'Delete' button in the 'Actions' column. For card view, hover over the card and click the 'Delete' button. Confirm your action in the dialog."
"How do I manage product categories?","Go to the 'Inventory' page, then click 'Manage Categories'. Here you can add or remove categories for your inventory items."
"How do I create a new Sales Order (Invoice)?","Navigate to the 'Orders' page. Click 'Create New Order' and select 'Sales Order (Invoice)'. Fill in customer details, add items from your inventory, set terms, and specify a due date."
"How do I create a new Purchase Order?","Navigate to the 'Orders' page. Click 'Create New Order' and select 'Purchase Order'. Fill in supplier details, add items you wish to order, set terms, and specify a due date."
"How do I edit an existing order?","On the 'Orders' page, find the order you wish to edit. Click 'View' or 'Edit' in the 'Actions' column. You can modify order details, items, and status."
"How do I archive an order?","On the 'Orders' page, find the order you wish to archive. In the 'Actions' column, click 'Archive'. Archived orders can be viewed using the 'Archived Orders' filter."
"How do I fulfill a sales order?","On the 'Orders' page, click 'Order Actions' and select 'Fulfill Order'. Choose the sales order, enter the quantities fulfilled for each item, and complete the process to update inventory."
"How do I receive a purchase order shipment?","On the 'Orders' page, click 'Order Actions' and select 'Receive Shipment'. Choose the purchase order, enter the quantities received for each item, and complete the process to update inventory."
"What is the Kanban Board for Orders?","The Kanban Board on the 'Orders' page provides a visual, drag-and-drop interface to track the status of your sales and purchase orders through different stages (e.g., New Order, Processing, Packed, Shipped)."
"How do I manage customers?","Go to the 'Customers' page. You can add new customers, edit their contact information, and delete customer records. You can also import customers in bulk via CSV."
"How do I manage vendors (suppliers)?","Go to the 'Vendors' page. You can add new vendors, edit their contact information, and delete vendor records."
"What is the 'Warehouse Operations' page for?","This page is optimized for mobile devices and provides dedicated tools for warehouse tasks like Item Lookup, Receive Inventory, Putaway, Fulfill Order, Ship Order, Picking Wave Management, Replenishment, Shipping Verification, Returns Processing, Stock Transfer, Cycle Count, and Issue Reporting."
"How do I use the barcode scanner in Warehouse Operations?","On the 'Warehouse Operations' page, select a tool (e.g., 'Item Lookup'). You'll see a 'Scan Barcode/QR' button. Tapping this will activate your device's camera to scan barcodes or QR codes, automatically populating relevant fields or searching for items."
"How do I generate reports?","Visit the 'Reports' page. Select a report from the sidebar (e.g., Inventory Valuation, Sales by Customer). You can apply date range filters and then click 'Print/PDF' to generate a printable document."
"How do I get an AI Summary for a report?","On the 'Reports' page, after selecting a report, click the 'AI Summary' button. The system will generate a concise, professional summary of the report's key insights. This feature requires a Premium or Enterprise plan."
"How do I connect to QuickBooks?","Go to 'Integrations'. Click 'Connect to QuickBooks'. You will be redirected to Intuit to authorize the connection. This feature requires a Premium or Enterprise plan."
"How do I disconnect from QuickBooks?","On the 'Integrations' page, if QuickBooks is connected, click 'Disconnect QuickBooks'. This will remove the authorization from Fortress."
"How do I sync sales orders to QuickBooks?","On the 'Integrations' page, if QuickBooks is connected, click 'Sync Sales Orders to QuickBooks'. This will push your shipped sales orders from Fortress to QuickBooks. This feature requires a Premium or Enterprise plan."
"How do I connect to Shopify?","Go to 'Integrations'. Click 'Connect to Shopify'. You will be prompted to enter your Shopify store URL, then redirected to Shopify to authorize the connection. This feature requires a Premium or Enterprise plan."
"How do I disconnect from Shopify?","On the 'Integrations' page, if Shopify is connected, click 'Disconnect Shopify'. This will remove the authorization from Fortress."
"How do I sync products from Shopify?","On the 'Integrations' page, if Shopify is connected, click 'Sync Products from Shopify'. This will import your Shopify products into Fortress inventory. This feature requires a Premium or Enterprise plan."
"How do I map Shopify locations to Fortress folders?","On the 'Integrations' page, after connecting Shopify, you can fetch your Shopify locations. Then, you can map each Shopify location to an existing Fortress inventory folder to ensure accurate stock synchronization."
"How do I add new users/employees to my organization?","As an administrator, navigate to the 'Users' page. Share your unique 'Organization Code' (also found on this page) with new users. They can enter this code during their sign-up to join your organization."
"How do I change a user's role?","On the 'Users' page, as an administrator, you can select a new role (Viewer, Manager, Admin) from the dropdown next to each user's name. This feature requires administrative privileges."
"How do I delete a user?","On the 'Users' page, as an administrator, click the 'Trash' icon next to the user you wish to delete. Confirm your action in the dialog. This action is permanent and requires administrative privileges."
"What are the different user roles and their permissions?","'Viewer' can view dashboards, inventory, orders, and reports. 'Inventory Manager' has all Viewer permissions plus managing inventory, creating/editing orders, and accessing warehouse operations. 'Admin' has full access to all features, including user management, settings, and integrations."
"What is the Automation Engine?","The Automation Engine allows you to create custom rules to automate repetitive tasks based on triggers and conditions (e.g., send a notification when stock is low). This is an Enterprise-level feature."
"How do I view activity logs?","As an administrator, navigate to the 'Activity Logs' page. Here you can view a detailed log of all user activities within your organization, filtered by date range."
"What are the available pricing plans?","Fortress offers Free, Standard, Premium, and Enterprise plans. You can view details and upgrade on the 'Billing & Subscriptions' page."
"What features are included in the Free plan?","The Free plan includes Basic Inventory Management (up to 500 items), Dashboard Overview, and Basic Order Management."
"What features are included in the Standard plan?","The Standard plan includes all Free features, plus up to 1000 items, Customer & Vendor Management, and more advanced reporting capabilities."
"What features are included in the Premium plan?","The Premium plan includes all Standard features, plus Unlimited Items, Advanced Reporting, AI Summary for Reports, QuickBooks Integration, and Shopify Integration."
"What features are included in the Enterprise plan?","The Enterprise plan includes all Premium features, plus the Automation Engine, and Dedicated Support."
"How do I upgrade or manage my subscription?","Go to the 'Billing & Subscriptions' page. You can choose a new plan or click 'Manage Subscription' to access the Stripe Customer Portal for billing history and payment method updates."
"How do I update my personal profile information?","Go to 'My Profile'. You can update your full name, phone number, and address. Your email is tied to authentication and cannot be changed here."
"How do I change my account password?","Go to 'Account Settings'. You can change your password in the 'Password & Security' section."
"How do I change the organization's theme?","As an administrator, go to 'Settings' > 'Organization Theme'. You can select from various themes (Dark, Emerald, Deep Forest, Tropical Indigo) which will apply to all users in your organization."
"Where can I find more help or contact support?","Visit the 'Help Center' page for FAQs and resources. You can also click the 'Contact Support' button for direct assistance."
"Where can I see the latest app updates?","Visit the 'What's New?' page to see recent features, improvements, and bug fixes."
"How do I adjust the quantity of an item?","You can adjust an item's stock from its Quick View dialog (click 'View Details' on an item card or table row) or by editing the item's full details page."
"What is the difference between 'Picking Bin Quantity' and 'Overstock Quantity'?","'Picking Bin Quantity' is the stock readily available for immediate order fulfillment. 'Overstock Quantity' is reserve stock, typically stored in less accessible areas, to replenish the picking bin."
"How do I set a reorder level for an individual item?","When adding or editing an inventory item, you can set an 'Overall Reorder Level' and a 'Picking Bin Reorder Level'. When stock drops below these, alerts can be triggered."
"Can I add tags or notes to an inventory item?","Yes, when adding or editing an item, you can add comma-separated tags and detailed notes in the respective fields."
"How do I view the full details of an inventory item?","From the 'Inventory' page, click the 'Edit' button next to an item in the table view, or click 'View Full Details' from the item's Quick View dialog."
"Where can I see the history of an item's stock movements?","On an item's full details page, there's a 'View All History' button that takes you to a dedicated page showing all 'add' and 'subtract' movements for that item."
"How do I generate a QR code for an item?","QR codes for items are automatically generated based on their SKU. You can view and print them from the item's Quick View or full details page."
"What happens if an item goes 'Out of Stock'?","Items with zero quantity will be marked as 'Out of Stock' and appear in relevant reports and alerts. You can configure auto-reorder to prevent this."
"Can I filter inventory by category or status?","Yes, on the 'Inventory' page, you can use the dropdown filters to narrow down items by 'Category' or 'Status' (In Stock, Low Stock, Out of Stock)."
"How do I search for an item?","Use the search bar on the 'Inventory' page to search by item name, SKU, or description. You can also use the global search in the header."
"What is 'Committed Stock' and 'Incoming Stock'?","'Committed Stock' is the quantity of an item reserved for open sales orders. 'Incoming Stock' is the quantity expected from open purchase orders."
"How do I change an item's assigned folder?","You can change an item's primary storage folder when editing its full details. For bulk changes, use the 'Stock Transfer' tool in Warehouse Operations."
"What are the different order statuses?","Order statuses include 'New Order', 'Processing', 'Packed', 'Shipped', 'On Hold / Problem', and 'Archived'."
"How do I add an item to an order that isn't in my inventory?","When creating a new order, you can manually add items by clicking '+ Add Item' and entering the details directly, even if they aren't in your existing inventory."
"Can I reorder items within an order?","Yes, when creating or editing an order, you can drag and drop items in the items table to reorder them."
"How do I print a Purchase Order?","When creating or editing a Purchase Order, click the 'Print/PDF' button to generate a printable document."
"How do I print a Sales Order (Invoice)?","When creating or editing a Sales Order (Invoice), click the 'Print/PDF' button to generate a printable document."
"What is 'Delivery Route' in an order?","'Delivery Route' is an optional field in sales orders to specify the route for delivery, useful for organizing shipments in warehouse operations."
"Can I add notes to an order?","Yes, there is a dedicated 'Notes' section when creating or editing both sales and purchase orders."
"How do I view items within an an order?","When viewing or editing an order, the 'Items' section displays a table of all products included in that order."
"What happens if I partially fulfill an order?","If you fulfill only some items or quantities of an order, its status will typically remain 'Processing' or move to 'Packed' if all items are picked, but not yet shipped."
"How do I mark an order as 'On Hold / Problem'?","You can change an order's status to 'On Hold / Problem' when editing the order details. This is useful for flagging issues that need attention."
"How do I find a specific customer/vendor?","Use the search bar on the 'Customers' or 'Vendors' page to search by name, contact person, email, phone, or address."
"What information can I store for a customer/vendor?","For both customers and vendors, you can store their name, contact person, email, phone, address, and additional notes."
"Can I add multiple contact persons for a vendor?","Currently, the system supports one primary 'Contact Person' field. You can include additional contacts in the 'Notes' field."
"How do I update a customer's address?","On the 'Customers' page, click the 'Edit' button next to the customer, update the 'Address' field, and save changes."
"How do I quickly check an item's stock level? (Item Lookup)","Go to 'Warehouse Operations' and select 'Item Lookup'. You can type an item's name or SKU, or use the 'Scan Barcode/QR' button to quickly find its details and current stock."
"How do I process a new delivery from a supplier? (Receive Inventory)","Go to 'Warehouse Operations' and select 'Receive Inventory'. Enter or scan the Purchase Order (PO) number, then scan each item as it's received to update quantities."
"How do I move received items to their designated storage folders? (Putaway)","Go to 'Warehouse Operations' and select 'Putaway'. Load a received PO, then scan the destination folder and each item to confirm its placement."
"How do I pick items for a customer's order? (Fulfill Order)","Go to 'Warehouse Operations' and select 'Fulfill Order'. Enter or scan the Sales Order (SO) number, then scan each item as you pick it to mark it as fulfilled."
"How do I verify and dispatch a packed order? (Ship Order)","Go to 'Warehouse Operations' and select 'Ship Order'. Enter or scan the Sales Order (SO) number, then scan each item to verify it's included in the shipment before dispatch."
"How do I create a batch of orders for picking? (Picking Wave)","Go to 'Warehouse Operations' and select 'Picking Wave Management'. Filter and select multiple sales orders, then click 'Create Picking Wave' to generate a consolidated pick list."
"How do I move stock from overstock to picking bins? (Replenishment)","Go to 'Warehouse Operations' and select 'Replenishment Management'. The system will show items needing replenishment. You can create and assign tasks to move stock from overstock to picking bins."
"How do I ensure all items are on the truck before dispatch? (Shipping Verification)","Go to 'Warehouse Operations' and select 'Shipping Verification'. Select a delivery route or truck ID, then scan each item/pallet to verify it matches the expected shipment manifest."
"How do I handle items returned by customers? (Returns Processing)","Go to 'Warehouse Operations' and select 'Returns Processing'. Scan the returned item, specify the quantity and reason for return, and direct it to the appropriate folder (e.g., 'Returns Area')."
"How do I move items between different folders? (Stock Transfer)","Go to 'Warehouse Operations' and select 'Stock Transfer'. Select the item, specify the 'From Folder' and 'To Folder', enter the quantity, and confirm the transfer."
"How do I perform a physical count of my inventory? (Cycle Count)","Go to 'Warehouse Operations' and select 'Cycle Count'. Choose a folder to count, then physically count items and enter the quantities. The system will highlight discrepancies."
"How do I report a damaged or misplaced item? (Issue Report)","Go to 'Warehouse Operations' and select 'Issue Report'. Choose the issue type, optionally scan the affected item and folder, provide a description, and submit the report."
"What if my scanner isn't working in Warehouse Operations?","If the camera scanner isn't working, ensure your device has a working camera and you've granted camera permissions to the app. You can also switch to 'Manual Input' mode in the scanner dialog."
"Can I manually enter barcode data if scanning fails?","Yes, in the camera scanner dialog, you can toggle to 'Manual Input' mode to type in the barcode or QR code value directly."
"What is 'Suggested Putaway Location'?","When receiving inventory, the system may suggest a 'Putaway Folder' based on item category or predefined rules to guide where the item should be stored."
"How do I filter reports by date range?","On the 'Reports' page, use the 'Date Range Picker' at the top to select a specific period for your report data."
"What is 'Inventory Valuation' report?","This report shows the total monetary value of your inventory, grouped by category or folder, helping you understand your asset value."
"How does the 'Low/Out of Stock' report help me?","This report highlights items that are running low or are completely out of stock, enabling you to prioritize reordering and prevent stockouts."
"What does the 'Inventory Movement' report show?","This report provides a detailed log of all 'add' and 'subtract' stock movements, including quantities, reasons, and the user who performed the action."
"How can I see my top-selling products?","The 'Sales by Product' report shows which items are generating the most revenue and units sold, helping you identify best-sellers."
"What is the 'Profitability' report?","This report provides key financial metrics like Gross Margin and Net Margin, helping you understand the profitability of your sales."
"How accurate is the 'Advanced Demand Forecast'?","The 'Advanced Demand Forecast' uses historical data and simulated trends to predict future demand. While powerful, it's a forecast and should be cross-referenced with real-time market intelligence for critical decisions."
"Can I export any report to Excel?","Yes, most reports can be exported to Excel format for further analysis by clicking the 'Export to Excel' button."
"What is the 'Stock Discrepancy' report?","This report lists all recorded differences between system-recorded stock and physical counts, including the item, location, and reason for the discrepancy."
"How do I resolve a discrepancy in the report?","In the 'Stock Discrepancy Details' dialog (accessed from the Dashboard or Reports), you can view pending discrepancies and mark them as 'Resolved' after investigation or correction."
"How do I change my company's default currency?","Go to 'Settings' > 'Company Profile'. You can select your preferred default currency from the dropdown."
"Can I upload my company logo?","Yes, in 'Settings' > 'Company Profile', you can upload your company logo. It will appear on reports and other documents."
"How do I change my personal avatar?","Currently, your avatar is automatically generated from your full name. Future updates may allow custom avatar uploads."
"What are 'Custom Roles' and how do I use them?","'Custom Roles' (available to Admins) allow you to define specific sets of permissions for different user types beyond the default Viewer, Manager, and Admin roles. You can manage them from the 'Users' page."
"How do I enable/disable auto-reorder for individual items?","When adding or editing an inventory item, you can toggle 'Enable Auto-Reorder' and set an 'Auto-Reorder Quantity'."
"What is the 'Default Reorder Level' in settings?","This is a global setting in 'Settings' > 'Auto-Reorder Settings' that suggests a reorder level for new inventory items. Individual items can override this."
"How do I enable/disable auto-reorder notifications?","In 'Settings' > 'Auto-Reorder Settings', you can enable or disable notifications for when items hit their reorder level."
"Can I change my email address?","Your email address is tied to your authentication and cannot be changed directly within the app. You would need to update it through your Supabase authentication settings."
"How do I update my phone number or address in my profile?","Go to 'My Profile'. You can edit your 'Phone Number' and 'Address' fields and then click 'Save Changes'."
"What are 'Tags' for in inventory items?","Tags are keywords you can add to inventory items to help categorize them, make them easier to search, or group them for specific purposes."
"What data syncs between Fortress and QuickBooks?","Currently, Fortress can sync shipped sales orders to QuickBooks. Future updates will expand data synchronization."
"What data syncs between Fortress and Shopify?","Fortress can sync products from Shopify into your inventory. You can also map Shopify locations to Fortress folders for inventory management."
"What if my QuickBooks/Shopify connection fails?","If a connection fails, you'll receive an error message. Check your credentials, ensure your store/company is active, and try reconnecting. Contact support if the issue persists."
"Can I connect multiple Shopify stores?","Currently, Fortress supports connecting to one Shopify store per organization. Multi-store support may be available in future updates."
"What are the benefits of Shopify location mapping?","Mapping Shopify locations to Fortress folders ensures that when orders are fulfilled in Shopify, the correct inventory quantities are deducted from the corresponding physical storage locations in Fortress."
"I forgot my password, how do I reset it?","On the login page, click 'Forgot Password?'. Enter your email, and you'll receive a password reset link in your inbox."
"Why can't I access certain features?","Access to features depends on your assigned user role (Viewer, Manager, Admin) and your organization's subscription plan. Contact your administrator or check the 'Billing & Subscriptions' page."
"What should I do if I encounter an error?","If you see an error, try refreshing the page. If it persists, note down the error message and contact support via the 'Feedback' button in the header or the 'Help Center'."
"How do I provide feedback or report a bug?","Click the 'Flag' icon in the header to open the 'Submit Feedback / Report Issue' dialog. Fill in the subject and description, and submit."
"Is there a mobile app for Fortress?","Fortress is a web application designed to be fully responsive and optimized for mobile browsers. The 'Warehouse Operations' page offers a dedicated mobile-first experience for on-the-go tasks."
"How do I get live support?","Click the 'Contact Support' button in the 'Help Center' to initiate a live chat with our support team."
"What is the 'What's New?' page?","This page provides release notes for all new features, improvements, and bug fixes in Fortress, keeping you informed about the latest updates."
"Where can I find setup instructions?","Visit the 'Help Center' and look for the 'Fortress Setup Guide' link, or navigate directly to the 'Setup Instructions' page."
"What is the purpose of 'Activity Logs'?","'Activity Logs' (visible to Admins) provide a chronological record of all significant actions performed by users within the organization, useful for auditing and troubleshooting."
"How does the 14-day free trial work?","You can start a 14-day free trial for the Standard plan from the 'Billing & Subscriptions' page. You'll get access to all Standard features, and your trial will automatically convert to a paid subscription unless cancelled."
"What happens after my free trial ends?","After your 14-day free trial, your subscription will automatically convert to the chosen paid plan. You can manage or cancel your subscription in the Stripe Customer Portal."
