"Question","Answer"
"Can I change my plan at any time?","Yes, you can upgrade or downgrade your subscription plan at any time from the 'Billing & Subscriptions' page. Changes will take effect immediately or at the next billing cycle."
"How do I update my payment method?","To update your payment method or view billing history, click 'Manage Subscription' on the 'Billing & Subscriptions' page. This will redirect you to the secure Stripe Customer Portal."
"Where can I view my past invoices?","Your past invoices and billing history are accessible through the Stripe Customer Portal. Click 'Manage Subscription' on the 'Billing & Subscriptions' page to access it."
"What is the cost difference between monthly and annual billing?","Annual billing typically offers a discount (e.g., 17% off) compared to monthly billing. You can see the exact pricing on the 'Billing & Subscriptions' page."
"Can I customize the fields for inventory items?","Currently, inventory item fields are standardized. Future updates may introduce custom fields."
"How do I manage multiple warehouses or storage areas?","You can create separate 'Folders' for each warehouse, area, or bin location within your organization to categorize and track inventory."
"What is the 'Picking Bin Folder' for?","The 'Picking Bin Folder' specifies the primary location where an item is stored for quick access during order picking."
"Can I set different reorder levels for picking bin and overstock?","Yes, you can set both an 'Overall Reorder Level' (for total stock) and a 'Picking Reorder Level' (specifically for the picking bin quantity)."
"How do I view items in a specific folder?","Navigate to the 'Folders' page, then click on a folder's name to view all inventory items and subfolders within it."
"Can I create subfolders within existing folders?","Yes, on a folder's content page, you can click '+ Add Subfolder' to create nested organizational structures."
"What happens if I delete a folder with items or subfolders?","If you attempt to delete a folder that contains items or subfolders, the system will warn you and prevent deletion until the folder is empty."
"How do I add items to a sales order from my inventory?","When creating a sales order, click 'Add from Inventory' to browse and select existing items to include in the order."
"Can I add items to a purchase order from my inventory?","Yes, when creating a purchase order, click 'Add from Inventory' to select items you typically purchase, pre-filling their details."
"What is 'Putaway Status' in orders?","'Putaway Status' is a field for purchase orders, indicating whether the received items have been moved to their final storage locations (Pending, Completed, N/A)."
"How do I update a customer's email or phone number?","On the 'Customers' page, click 'Edit' next to the customer, update the 'Email' or 'Phone' field, and save changes."
"How do I update a vendor's contact person or email?","On the 'Vendors' page, click 'Edit' next to the vendor, update the 'Contact Person' or 'Email' field, and save changes."
"Can I assign a primary vendor to an inventory item?","Yes, when adding or editing an inventory item, you can select a 'Primary Vendor' from your list of vendors."
"What is the 'Dashboard Summary' report?","This report provides a high-level overview of your key operational metrics, including inventory value, stock levels, and recent order activity."
"What is the 'Sales by Customer' report?","This report breaks down your sales revenue and item quantities by individual customer, helping you identify your most valuable clients."
"What is the 'Sales by Product' report?","This report shows the total revenue and units sold for each product, helping you understand product performance."
"What is the 'Purchase Order Status' report?","This report gives you an overview of all your purchase orders, including their current status, supplier, and total amount."
"What is the 'Stock Discrepancy' report?","This report details all recorded differences between expected and actual stock counts, including the reason and who reported it."
"How do I use the 'Advanced Demand Forecast' report?","Select an item (or 'All Items') in the report configuration. The report will display historical demand and AI-powered predictions for future demand over the next three months."
"Can I export reports as PNG images?","Currently, reports can be printed or exported as PDF. For PNG, you might need to use your system's screenshot tools."
"What is the 'Total Stock Value' on the Dashboard?","This metric represents the total monetary value of all your inventory items currently on hand."
"What is the 'Order Fulfillment Rate' on the Dashboard?","This metric shows the percentage of your sales orders that have been successfully fulfilled (packed or shipped)."
"What is 'Inventory Turnover Rate' on the Dashboard?","This metric indicates how many times your entire inventory has been sold and replaced over a period, reflecting sales efficiency."
"What is 'Supplier Performance Score' on the Dashboard?","This is a simulated score reflecting factors like delivery timeliness and quality from your suppliers (Green: good, Yellow: average, Red: bad)."
"What is 'Live Metrics' on the Dashboard?","This card provides a real-time snapshot of key operational activities like low stock items, orders due today, and recent adjustments."
"What is 'Monthly Activity Overview' on the Dashboard?","This chart displays trends in sales revenue, inventory value, and purchase volume over the last 12 months."
"What is 'Location Stock Health' on the Dashboard?","This card shows a quick overview of stock movement and health for your top inventory folders."
"How do I enable Two-Factor Authentication (2FA)?","Go to 'Account Settings' > 'Password & Security'. You can toggle the 'Two-Factor Authentication' switch to enable it."
"Can I change my organization's unique code?","As an administrator, you can update your 'Organization Code' in 'Settings' > 'Organization Code'. New users will need the updated code to join."
"What is the 'Setup Instructions' page?","This page provides a step-by-step guide for new users to quickly set up their company profile, add inventory, manage vendors, and create orders."
"How do I access the 'Warehouse Dashboard'?","Go to 'Warehouse Operations' and select the 'Dashboard' tab. It provides a quick overview of unread notifications, low stock, pending receives, and shipments."
"What is 'Picking Wave Management'?","This tool allows you to group multiple sales orders into a single 'picking wave' to optimize the picking process for efficiency."
"What is 'Replenishment Management'?","This tool helps manage the movement of stock from overstock locations to picking bins when picking bin quantities are low."
"What is 'Shipping Verification'?","This tool helps verify that all items for a shipment are correctly loaded onto a truck before dispatch, reducing errors."
"What is 'Returns Processing'?","This tool streamlines the process of handling returned items, allowing you to record reasons and direct items to appropriate storage areas."
"What is 'Stock Transfer'?","This tool allows you to accurately record the movement of inventory items between different storage folders within your warehouse."
"What is 'Cycle Count'?","This tool facilitates periodic physical counts of inventory in specific folders to identify and reconcile discrepancies with system records."
"What is 'Issue Report'?","This tool allows warehouse staff to quickly report any operational issues, such as damaged items, misplaced stock, or safety hazards."
"Can I print labels for individual items?","Currently, you can generate QR code labels for folders. Item-specific label printing may be available in future updates."
"What is the purpose of 'Custom Roles'?","Custom roles allow administrators to define granular permissions for users, ensuring they only have access to the features necessary for their job function."
"How do I create a custom role?","As an administrator, go to 'Users' and click 'Manage Custom Roles'. You can then click 'Create New Role' and select the features/permissions for it."
"How do I edit a custom role?","As an administrator, go to 'Users' > 'Manage Custom Roles'. Click the 'Edit' icon next to the role you wish to modify."
"How do I delete a custom role?","As an administrator, go to 'Users' > 'Manage Custom Roles'. Click the 'Trash' icon next to the role you wish to delete. Ensure no users are assigned to it first."
"What happens if I try to delete a custom role that is in use?","The system will prevent deletion if the role is currently assigned to any users, prompting you to reassign users first (future feature)."
"Can I assign custom roles to users?","Currently, custom roles are defined, but user assignment to custom roles is a future feature. Users are assigned to default roles (Viewer, Manager, Admin)."
"What is the 'Activity Logs' page for?","The 'Activity Logs' page provides a comprehensive audit trail of all actions performed by users within your organization, including who did what and when."
"Can I filter activity logs by user or activity type?","Currently, activity logs can be filtered by date range. Future updates may include filtering by user or activity type."
"How do I export activity logs?","Currently, activity logs can be viewed in the app. Export functionality may be added in future updates."
"What is the 'Billing & Subscriptions' page?","This page allows you to view your current plan, explore other available plans, upgrade your subscription, and manage your billing details via the Stripe Customer Portal."
"Can I try a paid plan before committing?","Yes, you can start a 14-day free trial for the Standard plan directly from the 'Billing & Subscriptions' page."
"What payment methods are accepted?","All major credit cards are accepted through our secure payment processor, Stripe. You can manage your payment methods in the Stripe Customer Portal."
"Is my billing information secure?","Yes, all billing information is handled securely by Stripe, a PCI-compliant payment processor. Fortress does not store your full payment details."
"What if I need an Enterprise plan?","For Enterprise plan details and custom solutions, please contact our sales team directly. You can find contact information in the 'Help Center'."
"Can I get a refund if I cancel my subscription?","Refund policies are detailed in our Terms of Service. Generally, subscriptions are non-refundable but can be cancelled to prevent future charges."
"How do I contact sales for a custom plan?","You can find contact information for sales in the 'Help Center' or by clicking the 'Contact Sales' option on the 'Billing & Subscriptions' page for the Enterprise plan."
"What is the 'Dashboard' page?","The 'Dashboard' page provides a high-level overview of your key inventory and order metrics, offering quick insights into your business performance."
"What is the 'Classic Dashboard' view?","The 'Classic Dashboard' is an alternative, streamlined view of essential metrics and quick actions, designed for users who prefer a more concise overview."
"How do I switch between dashboard views?","Currently, the default dashboard is active. Future updates may allow switching between 'Default' and 'Classic' views from user preferences."
"What is 'Total Daily Activity' on the Dashboard?","This chart on the dashboard shows the overall inventory movement (sales, purchases, adjustments) over a selected period."
"What is 'Sales vs. Inventory Trend Graph' on the Dashboard?","This graph compares your sales revenue trend against your inventory value trend over time, helping identify potential overstocking or shortages."
"What is 'Demand Forecast' on the Dashboard?","This card provides a basic forecast of future demand based on historical sales, helping you anticipate needs (more advanced in Premium/Enterprise reports)."
"What is 'Weekly Revenue' on the Dashboard?","This bar chart compares your sales revenue for the current week against the previous week, broken down by day."
"What is 'Profitability Metrics' on the Dashboard?","This card displays key profitability indicators like Gross Margin and Net Margin, giving you a quick financial health check."
"What is 'Top Stock Items' on the Dashboard?","This bullet graph highlights your top inventory items by quantity on hand."
"What is 'Low Stock Alerts' on the Dashboard?","This card lists items that are currently below their reorder level, prompting you to take action."
"What is 'Out-of-Stock Items' on the Dashboard?","This card lists items that currently have zero quantity, indicating critical stockouts."
"What is 'Slow-Moving / Deadstock Items' on the Dashboard?","This card (simulated) would highlight items that haven't moved in a while, suggesting potential promotions or bundling strategies."
"What is 'Recent Shipments' on the Dashboard?","This card lists recently dispatched sales orders, providing an overview of outgoing goods."
"What is 'Open Purchase Orders' on the Dashboard?","This card lists purchase orders that are still awaiting fulfillment from your suppliers."
"What is 'Pending Invoices' on the Dashboard?","This card highlights sales orders with overdue payments (e.g., 30+ days late)."
"What is 'Issues Reported' on the Dashboard?","This card shows the count of operational issues reported for the current period, with a link to view details."
"How do I view the details of reported issues?","Click 'View Issues' on the 'Issues Reported' card on the Dashboard to open a dialog with a list of all reported issues for the selected period."
"Can I filter reported issues by date range?","Yes, the 'Daily Issues Dialog' allows you to filter reported issues by a specific date range."
"How do I mark a reported issue as resolved?","In the 'Daily Issues Dialog', you can click 'Mark as Resolved' next to an issue to change its status."
"What is the 'Global Search' feature?","The 'Global Search' (accessed via the search icon in the header) allows you to quickly find inventory items, orders, vendors, and navigate to application pages."
"How do I use the 'Global Search'?","Click the search icon in the header, type your query (e.g., item name, SKU, order ID, vendor name, or page name), and select a result to navigate directly."
"What is the 'Notifications' page?","This page provides a comprehensive list of all your application alerts and updates, including low stock warnings, order status changes, and system messages."
"How do I mark notifications as read?","You can mark individual notifications as read by clicking on them, or click 'Mark all as read' on the 'Notifications' page or sheet."
"How do I clear all notifications?","Click 'Clear all' on the 'Notifications' page or sheet to remove all notifications from your list."
"What is the 'Feedback' dialog?","The 'Feedback' dialog (accessed via the flag icon in the header) allows you to submit suggestions, feature requests, or report bugs directly to the Fortress team."
"Can I submit feedback anonymously?","Yes, the 'Your Contact Info' field in the 'Feedback' dialog is optional. If left blank, your feedback will be anonymous."
"What is the 'Live Chat Widget'?","The 'Live Chat Widget' (visible on authenticated pages) provides direct access to our support team for real-time assistance."
"How do I start a chat with support?","Click the 'Contact Support' button in the 'Help Center' or the chat icon (if visible) to open the live chat widget."
"What is the 'Theme Initializer' component?","This component ensures that your organization's chosen theme is correctly applied when the application loads, providing a consistent visual experience."
"What is the 'Print Wrapper' component?","This component handles the logic for preparing and triggering print jobs for various reports and labels, ensuring they are formatted correctly for printing."
"What is the 'Camera Scanner Dialog'?","This dialog provides a universal interface for scanning barcodes and QR codes using your device's camera, used across various warehouse operations tools."
"Can I use an external barcode scanner?","The app is designed to work with your device's camera. Compatibility with external USB/Bluetooth scanners may vary but is generally supported if they emulate keyboard input."
"What is the 'Upgrade Prompt Dialog'?","This dialog appears for Free plan users on the dashboard, encouraging them to upgrade or start a free trial to access more advanced features."
"Why am I seeing the 'Upgrade Prompt Dialog'?","You are on the Free plan and this dialog is a reminder of the advanced features available in paid plans. You can dismiss it or choose to upgrade."
"Can I dismiss the 'Upgrade Prompt Dialog' permanently?","Yes, clicking 'Continue with Free Plan' or 'Upgrade Now' will mark the prompt as seen, and it will not reappear for a period."
"What is the 'Onboarding Page'?","This is the initial setup wizard that guides new users through configuring their company profile and essential inventory settings."
"Why do I need to complete onboarding?","Onboarding ensures your basic company information and inventory structure are set up correctly, which is crucial for the app's functionality."
"Can I skip the onboarding process?","The onboarding process is designed to get you started quickly. While you can navigate away, it's recommended to complete it for full app functionality."
"What is the 'Reset Password' page?","This page allows users to set a new password after initiating a password reset request from the login page."
"How do I get to the 'Reset Password' page?","You will be redirected to this page via a link sent to your email after using the 'Forgot Password?' option on the login screen."
"What is the 'Edit Inventory Item' page?","This page allows you to modify all details of an existing inventory item, including quantities, pricing, descriptions, and auto-reorder settings."
"What is the 'Edit Purchase Order' page?","This page allows you to modify all details of an existing purchase order, including supplier, items, quantities, prices, and status."
"What is the 'Edit Sales Order' page?","This page allows you to modify all details of an existing sales order (invoice), including customer, items, quantities, prices, and status."
"What is the 'Folder Content Page'?","This page displays all inventory items and subfolders contained within a specific inventory folder, allowing for focused management."
"Can I add items directly to a folder from its content page?","Yes, on the 'Folder Content Page', you can click '+ Add Item to Folder' to add a new inventory item directly to that specific folder."
"Can I add subfolders from a folder's content page?","Yes, on the 'Folder Content Page', you can click '+ Add Subfolder' to create a new subfolder nested within the current folder."
"What is the 'Activity Logs' page?","This page provides a detailed audit trail of all user actions within your organization, including who performed what action and when."
"Can I filter activity logs by date range?","Yes, the 'Activity Logs' page includes a date range picker to filter activities by specific periods."
"Who can view the 'Activity Logs' page?","The 'Activity Logs' page is only accessible to users with 'Admin' roles for security and auditing purposes."
"What is the 'Global Search Dialog'?","This dialog, accessible from the header, allows you to search across all inventory items, orders, vendors, and application pages from a single input."
"How do I open the 'Global Search Dialog'?","Click the search icon (magnifying glass) in the application header to open the global search dialog."
"What types of items can I search for in the 'Global Search'?","You can search for inventory items (by name, SKU, description), orders (by ID, customer/supplier, notes), vendors (by name, contact, email), and application pages (by name, description)."
"What is the 'Notification Sheet'?","This is a slide-out panel from the right side of the screen that displays your recent application notifications and alerts."
"How do I open the 'Notification Sheet'?","Click the bell icon in the application header to open the notification sheet."
"Can I mark all notifications as read at once?","Yes, the 'Notification Sheet' and 'Notifications' page both have a 'Mark all as read' button."
"Can I clear all notifications at once?","Yes, the 'Notification Sheet' and 'Notifications' page both have a 'Clear all' button."
"What is the 'Feedback Dialog'?","This dialog allows you to submit feedback, feature requests, or report issues directly to the development team."
"How do I open the 'Feedback Dialog'?","Click the flag icon in the application header to open the feedback dialog."
"Is my feedback anonymous?","You have the option to include your contact information. If you leave it blank, your feedback will be anonymous."
"What is the 'BackButton' component?","This component provides a convenient 'Back' button on most detail pages, allowing you to easily navigate back to the previous view."
"Where is the 'BackButton' located?","The 'BackButton' is typically located at the top-left of content areas on detail pages, but not on the main dashboard."
"Why is the 'BackButton' not visible on the dashboard?","The dashboard is considered the home page, so a 'Back' button is not necessary there."
"What is the 'ThemedAppContent' component?","This component wraps the main application content and ensures that the selected theme (from settings) is applied consistently across the app."
"What is the 'ThemeProvider' component?","This component from 'next-themes' manages the application's theme state and applies the correct CSS classes to the HTML element."
"What themes are available for the application?","The application supports 'dark', 'emerald', 'deep-forest', and 'tropical-indigo' themes, which can be set by an administrator."
"How do I know which theme is currently active?","The active theme is reflected in the application's visual style and can be seen in 'Account Settings' (though set by admin)."
"What is the 'PrintWrapper' component?","This component is responsible for rendering content specifically for printing, ensuring that only the desired elements are included in the print output."
"How does the printing functionality work?","When you click 'Print/PDF' on a report or label, the content is rendered within a 'PrintWrapper' which then triggers the browser's print dialog."
"Can I print multiple labels at once?","Yes, when generating labels (e.g., for folders), you can specify a quantity to print multiple copies."
"What is the 'CameraFeed' component?","This component directly interfaces with your device's camera to provide real-time barcode and QR code scanning capabilities."
"What barcode formats are supported by the scanner?","The scanner supports QR Code, Code 128, EAN-13, EAN-8, and UPC-A/E formats."
"What if the camera fails to start?","If the camera fails to start, the scanner dialog will display an error message with troubleshooting tips, such as checking permissions or retrying."
"Can I use the scanner on a desktop computer?","Yes, if your desktop computer has a webcam, the scanner can utilize it. However, it's primarily optimized for mobile devices."
"What is the 'UpgradePromptDialog'?","This dialog is shown to users on the Free plan, encouraging them to explore paid plans for advanced features."
"When does the 'UpgradePromptDialog' appear?","It appears for Free plan users on the dashboard after onboarding is complete, if they haven't seen it before."
"How do I permanently dismiss the 'UpgradePromptDialog'?","Clicking 'Continue with Free Plan' or 'Upgrade Now' will mark the prompt as seen, and it won't reappear for that user."
"What is the 'LiveChatWidget'?","This widget embeds a live chat service (Tawk.to) into the application, allowing users to get real-time support."
"Where is the 'LiveChatWidget' visible?","The live chat widget is typically visible on authenticated pages of the application, providing easy access to support."
"What is the 'ErrorBoundary' component?","This component catches JavaScript errors in its child component tree and displays a fallback UI, preventing the entire application from crashing."
"What should I do if I see the 'Something went wrong' error screen?","This indicates an unhandled error. Try clicking 'Refresh Page'. If it persists, contact support with the error details shown."
"What is the 'DefaultDashboardContent' component?","This is the primary dashboard view, offering a comprehensive set of cards and charts for various metrics and insights."
"What is the 'ClassicDashboard' component?","This is an alternative, simplified dashboard view focusing on essential metrics and quick actions."
"How do I switch between the 'Default' and 'Classic' dashboards?","Currently, the default dashboard is active. Future updates may allow switching between views from user preferences."
"What is the 'OnboardingWizard' component?","This component guides new users through the initial setup steps, including company profile and inventory folder creation."
"What steps are included in the 'OnboardingWizard'?","The wizard includes 'Company Profile' setup and 'Inventory Folders' setup."
"Can I go back to previous steps in the 'OnboardingWizard'?","Yes, you can use the 'Back' button within the wizard to revisit previous steps."
"What happens if I close the 'OnboardingWizard' before completing it?","If you close the wizard, you'll be redirected to the dashboard. You can complete the setup later via the 'Settings' page."
"What is the 'ResetPassword' page for?","This page allows you to set a new password for your account after initiating a password reset request."
"How do I access the 'ResetPassword' page?","You will be redirected to this page via a secure link sent to your email after using the 'Forgot Password?' option on the login screen."
