"Question","Answer"
"What is the 'Users' page?","This page, accessible to administrators, allows you to view all users in your organization, manage their roles, and delete user accounts."
"What is the 'ActivityLogs' page?","This page provides a detailed audit trail of all user actions within your organization, including who performed what action and when."
"What is the 'Folders' page?","This page allows you to manage your inventory organizational folders, create new ones, edit existing ones, and generate QR code labels for them."
"What is the 'Customers' page?","This page allows you to manage your customer database, including adding new customers, editing their details, and importing customer lists."
"What is the 'Integrations' page?","This page allows you to connect Fortress with third-party services like QuickBooks and Shopify, enabling data synchronization and enhanced workflows."
"What is the 'Automation' page?","This page, accessible to Enterprise plan administrators, allows you to create and manage automated rules for various tasks within the application."
"What is the 'ItemHistoryPage'?","This page provides a comprehensive log of all stock movements for a specific inventory item, including additions, subtractions, reasons, and users."
"What is the 'FolderContentPage'?","This page displays all inventory items and subfolders that are directly contained within a selected inventory folder."
"Can I add new items directly from the 'FolderContentPage'?","Yes, you can add new inventory items directly to the current folder from its content page."
"Can I create new subfolders from the 'FolderContentPage'?","Yes, you can create new subfolders nested within the current folder from its content page."
"What is the 'AddInventoryDialog'?","This dialog allows you to add a new inventory item to your system, specifying its details, quantities, pricing, and folder assignment."
"What is the 'ScanItemDialog'?","This dialog provides a quick way to look up an item by entering or scanning its barcode/SKU."
"What is the 'CategoryManagementDialog'?","This dialog allows administrators or inventory managers to add, view, or remove product categories."
"What is the 'BulkUpdateDialog'?","This dialog allows you to upload a CSV file to update multiple inventory items simultaneously, matching them by SKU."
"What is the 'ImportCsvDialog'?","This dialog allows you to upload a CSV file to import new inventory items into your system."
"What is the 'AutoReorderSettingsDialog'?","This dialog allows administrators or inventory managers to configure global settings for automatic reordering and notifications."
"What is the 'ConfirmDialog'?","This is a generic confirmation dialog used throughout the app to ask for user confirmation before performing irreversible actions like deletion."
"What is the 'InventoryItemQuickViewDialog'?","This dialog provides a quick overview of an inventory item's details and allows for quick stock adjustments."
"What is the 'AddEditCustomerDialog'?","This dialog allows you to add a new customer or edit the details of an existing customer."
"What is the 'AddEditVendorDialog'?","This dialog allows you to add a new vendor or edit the details of an existing vendor."
"What is the 'DuplicateCustomersWarningDialog'?","This dialog appears during customer CSV import if duplicate customer names or emails are detected, allowing you to choose how to handle them."
"What is the 'DuplicateItemsWarningDialog'?","This dialog appears during inventory CSV import if duplicate SKUs are detected, allowing you to choose how to handle them (skip, add to stock, update)."
"What is the 'NotificationPreferencesDialog'?","This dialog (simulated) would allow users to customize their notification settings for various alerts like low stock or new orders."
"What is the 'SupplierInfoDialog'?","This dialog displays the contact and address details of the primary supplier for a selected inventory item."
"What is the 'EditWalletBalanceDialog'?","This dialog allows you to manually adjust the simulated cash balance in your wallet on the dashboard."
"What is the 'ShopifyStoreUrlDialog'?","This dialog prompts you to enter your Shopify store's URL before initiating the Shopify integration process."
"What is the 'ManageCustomRolesDialog'?","This dialog, accessible to administrators, allows you to create, edit, and delete custom user roles and define their permissions."
"What is the 'AutomationRuleDialog'?","This dialog allows administrators to create or edit individual automation rules, defining their trigger, condition, and action."
"What is the 'OrderFulfillmentDialog'?","This dialog allows you to process the fulfillment of a sales order by specifying quantities picked for each item."
"What is the 'OrderReceiveShipmentDialog'?","This dialog allows you to process the receipt of a purchase order shipment by specifying quantities received for each item."
"What is the 'TransferStockDialog'?","This dialog allows you to record the transfer of a specific quantity of an item from one folder to another."
"What is the 'StockDiscrepancyDetailsDialog'?","This dialog displays a list of all pending stock discrepancies for a selected date range, allowing administrators to review and resolve them."
"What is the 'DailyIssuesDialog'?","This dialog displays a list of all operational issues reported for a selected date range, allowing administrators to review them."
"What is the 'GenerateReportButton'?","This button, found on the dashboard, allows you to quickly generate a PDF summary report of your current dashboard metrics."
"What is the 'ReportSidebar'?","This sidebar on the 'Reports' page allows you to navigate between different categories and types of reports available in the application."
"What is the 'AiSummarySidebar'?","This sidebar appears on the 'Reports' page when you request an AI summary, displaying the generated summary text and options to copy or print it."
"What is the 'CompanyProfileStep' in onboarding?","This is the first step of the onboarding wizard where you enter your company's name, currency, address, and optionally upload a logo."
"What is the 'FolderSetupStep' in onboarding?","This is the second step of the onboarding wizard where you define your initial inventory storage folders."
"What is the 'OnboardingWizard' component?","This component guides new users through the initial setup steps, including company profile and inventory folder creation."
"What is the 'AuthenticatedApp' component?","This component renders the main application routes and layout for users who are successfully authenticated."
"What is the 'AppContent' component?","This is the main wrapper component that handles authentication routing, global dialogs, and print rendering for the entire application."
"What is the 'ProfileProvider' context?","This context manages the currently logged-in user's profile data and their organization's company profile, making it accessible throughout the app."
"What is the 'OrdersProvider' context?","This context manages all sales and purchase orders, providing functions to fetch, add, update, and archive orders."
"What is the 'VendorProvider' context?","This context manages all vendor (supplier) data, providing functions to fetch, add, update, and delete vendors."
"What is the 'CustomerProvider' context?","This context manages all customer data, providing functions to fetch, add, update, and delete customers."
"What is the 'CategoryProvider' context?","This context manages all product categories, providing functions to fetch, add, and remove categories."
"What is the 'NotificationProvider' context?","This context manages in-app notifications, providing functions to add, mark as read, and clear notifications."
"What is the 'StockMovementProvider' context?","This context manages all inventory stock movement logs, providing functions to fetch and add movement records."
"What is the 'ReplenishmentProvider' context?","This context manages replenishment tasks, providing functions to fetch, add, and update tasks for moving stock."
"What is the 'InventoryProvider' context?","This context manages all inventory items, providing functions to fetch, add, update, and delete items."
"What is the 'AutomationProvider' context?","This context manages automation rules, providing functions to fetch, add, update, and delete rules."
"What is the 'Auth' page?","This is the login and signup page for the application."
"What is the 'ResetPassword' page?","This page allows users to set a new password after initiating a password reset request."
"What is the 'Dashboard' page?","This is the main landing page after login, providing an overview of key business metrics."
"What is the 'Inventory' page?","This page lists all your inventory items and allows for management, filtering, and bulk actions."
"What is the 'Orders' page?","This page lists all your sales and purchase orders, with options for filtering, creating new orders, and quick actions."
"What is the 'Reports' page?","This page provides access to various analytical reports about your inventory, sales, and operations."
"What is the 'Settings' page?","This page allows administrators to configure company-wide settings, including company profile, theme, and organization code."
"What is the 'CreatePurchaseOrder' page?","This page provides a form to create a new purchase order."
"What is the 'EditInventoryItem' page?","This page provides a form to edit the details of a specific inventory item."
"What is the 'EditPurchaseOrder' page?","This page provides a form to edit the details of a specific purchase order."
"What is the 'MyProfile' page?","This page allows individual users to view and update their personal profile information."
"What is the 'AccountSettings' page?","This page allows individual users to manage their account preferences and security settings."
"What is the 'NotificationsPage'?","This page displays a full list of all application notifications and allows for management."
"What is the 'BillingSubscriptions' page?","This page allows users to manage their subscription plan, view invoices, and update payment methods."
"What is the 'HelpCenter' page?","This page provides access to FAQs, help articles, and options to contact support."
"What is the 'WhatsNew' page?","This page displays the latest updates, features, and bug fixes for the application."
"What is the 'Vendors' page?","This page lists all your vendors (suppliers) and allows for management."
"What is the 'Users' page?","This page, accessible to administrators, allows for managing user accounts and roles within the organization."
"What is the 'CreateInvoice' page?","This page provides a form to create a new sales order (invoice)."
"What is the 'SetupInstructions' page?","This page provides a step-by-step guide for new users to get started with Fortress."
"What is the 'WarehouseOperationsPage'?","This page provides a mobile-optimized interface for various warehouse tasks and tools."
"What is the 'Folders' page?","This page allows you to manage your inventory organizational folders and generate QR code labels."
"What is the 'Customers' page?","This page lists all your customers and allows for management."
"What is the 'Integrations' page?","This page allows you to connect Fortress with third-party services like QuickBooks and Shopify."
"What is the 'Automation' page?","This page, accessible to Enterprise plan administrators, allows you to create and manage automated rules."
"What is the 'ItemHistoryPage'?","This page displays a detailed history of all stock movements for a specific inventory item."
"What is the 'FolderContentPage'?","This page displays all inventory items and subfolders within a selected inventory folder."
"What is the 'ActivityLogs' page?","This page displays a detailed audit trail of all user actions within your organization."